{
  "$schema": "https://loxtep.io/schemas/data-product-package-v1.json",
  "template_type": "data_product",
  "slug": "blank-consumer",
  "name": "Blank Consumer Data Product",
  "description": "Create a consumer data product from scratch. Empty composed/projected data product for custom configuration.",
  "version": "1.0.0",
  "tags": [
    "blank",
    "starter",
    "consumer"
  ],
  "use_cases": [
    "Start from scratch",
    "Custom consumer data product"
  ],
  "entity": {
    "data_product_id": "{{DATA_PRODUCT_ID}}",
    "organization_id": "{{ORGANIZATION_ID}}",
    "workflow_id": "{{WORKFLOW_ID}}",
    "domain_id": "{{DOMAIN_ID}}",
    "name": "{{DATA_PRODUCT_NAME}}",
    "description": "",
    "kind": "consumer",
    "owner": {
      "user_id": "{{USER_ID}}"
    },
    "status": "draft",
    "governance": {
      "classification": "internal",
      "pii_fields": [],
      "compliance_requirements": [],
      "tags": []
    },
    "metadata": {
      "business_glossary": {},
      "refresh_frequency": "",
      "expected_latency_ms": null
    },
    "created_at": "{{CREATED_AT}}",
    "updated_at": "{{UPDATED_AT}}",
    "odps_document": {
      "product": {
        "details": {
          "en": {
            "name": "{{DATA_PRODUCT_NAME}}",
            "description": "",
            "status": "draft",
            "tags": [],
            "governanceProfile": "internal"
          }
        },
        "dataHolder": {
          "businessDomain": "{{DOMAIN_ID}}",
          "dataProductOwner": "{{USER_ID}}"
        },
        "custom": {
          "loxtep": {
            "organization_id": "{{ORGANIZATION_ID}}",
            "domain_id": "{{DOMAIN_ID}}",
            "project_id": "{{PROJECT_ID}}",
            "workflow_id": "{{WORKFLOW_ID}}"
          }
        }
      }
    }
  },
  "placeholders": {
    "{{DATA_PRODUCT_ID}}": "Generated UUID for the data product",
    "{{ORGANIZATION_ID}}": "Organization that owns this data product",
    "{{WORKFLOW_ID}}": "Workflow (flow) that produces this data product in the graph",
    "{{PROJECT_ID}}": "Project containing the workflow",
    "{{DOMAIN_ID}}": "Domain this data product belongs to",
    "{{DATA_PRODUCT_NAME}}": "User-provided name for the data product",
    "{{USER_ID}}": "Owner user ID",
    "{{CREATED_AT}}": "ISO 8601 timestamp",
    "{{UPDATED_AT}}": "ISO 8601 timestamp"
  }
}
